[
  {
    "name": "applicable-models/architecture/ensemble",
    "slug": "applicable-models-architecture-ensemble",
    "count": 1,
    "category": "applicable-models"
  },
  {
    "name": "applicable-models/architecture/linear-models",
    "slug": "applicable-models-architecture-linear-models",
    "count": 5,
    "category": "applicable-models"
  },
  {
    "name": "applicable-models/architecture/linear-models/gam",
    "slug": "applicable-models-architecture-linear-models-gam",
    "count": 1,
    "category": "applicable-models"
  },
  {
    "name": "applicable-models/architecture/linear-models/logistic",
    "slug": "applicable-models-architecture-linear-models-logistic",
    "count": 2,
    "category": "applicable-models"
  },
  {
    "name": "applicable-models/architecture/linear-models/regression",
    "slug": "applicable-models-architecture-linear-models-regression",
    "count": 1,
    "category": "applicable-models"
  },
  {
    "name": "applicable-models/architecture/model-agnostic",
    "slug": "applicable-models-architecture-model-agnostic",
    "count": 110,
    "category": "applicable-models"
  },
  {
    "name": "applicable-models/architecture/neural-networks",
    "slug": "applicable-models-architecture-neural-networks",
    "count": 31,
    "category": "applicable-models"
  },
  {
    "name": "applicable-models/architecture/neural-networks/convolutional",
    "slug": "applicable-models-architecture-neural-networks-convolutional",
    "count": 2,
    "category": "applicable-models"
  },
  {
    "name": "applicable-models/architecture/neural-networks/feedforward",
    "slug": "applicable-models-architecture-neural-networks-feedforward",
    "count": 2,
    "category": "applicable-models"
  },
  {
    "name": "applicable-models/architecture/neural-networks/generative/gan",
    "slug": "applicable-models-architecture-neural-networks-generative-gan",
    "count": 2,
    "category": "applicable-models"
  },
  {
    "name": "applicable-models/architecture/neural-networks/generative/vae",
    "slug": "applicable-models-architecture-neural-networks-generative-vae",
    "count": 1,
    "category": "applicable-models"
  },
  {
    "name": "applicable-models/architecture/neural-networks/graph",
    "slug": "applicable-models-architecture-neural-networks-graph",
    "count": 1,
    "category": "applicable-models"
  },
  {
    "name": "applicable-models/architecture/neural-networks/recurrent",
    "slug": "applicable-models-architecture-neural-networks-recurrent",
    "count": 3,
    "category": "applicable-models"
  },
  {
    "name": "applicable-models/architecture/neural-networks/transformer",
    "slug": "applicable-models-architecture-neural-networks-transformer",
    "count": 5,
    "category": "applicable-models"
  },
  {
    "name": "applicable-models/architecture/neural-networks/transformer/llm",
    "slug": "applicable-models-architecture-neural-networks-transformer-llm",
    "count": 18,
    "category": "applicable-models"
  },
  {
    "name": "applicable-models/architecture/probabilistic",
    "slug": "applicable-models-architecture-probabilistic",
    "count": 1,
    "category": "applicable-models"
  },
  {
    "name": "applicable-models/architecture/probabilistic/gaussian-processes",
    "slug": "applicable-models-architecture-probabilistic-gaussian-processes",
    "count": 1,
    "category": "applicable-models"
  },
  {
    "name": "applicable-models/architecture/tree-based",
    "slug": "applicable-models-architecture-tree-based",
    "count": 4,
    "category": "applicable-models"
  },
  {
    "name": "applicable-models/architecture/tree-based/gradient-boosting",
    "slug": "applicable-models-architecture-tree-based-gradient-boosting",
    "count": 1,
    "category": "applicable-models"
  },
  {
    "name": "applicable-models/paradigm/discriminative",
    "slug": "applicable-models-paradigm-discriminative",
    "count": 9,
    "category": "applicable-models"
  },
  {
    "name": "applicable-models/paradigm/generative",
    "slug": "applicable-models-paradigm-generative",
    "count": 14,
    "category": "applicable-models"
  },
  {
    "name": "applicable-models/paradigm/parametric",
    "slug": "applicable-models-paradigm-parametric",
    "count": 12,
    "category": "applicable-models"
  },
  {
    "name": "applicable-models/paradigm/probabilistic",
    "slug": "applicable-models-paradigm-probabilistic",
    "count": 2,
    "category": "applicable-models"
  },
  {
    "name": "applicable-models/paradigm/reinforcement",
    "slug": "applicable-models-paradigm-reinforcement",
    "count": 2,
    "category": "applicable-models"
  },
  {
    "name": "applicable-models/paradigm/supervised",
    "slug": "applicable-models-paradigm-supervised",
    "count": 51,
    "category": "applicable-models"
  },
  {
    "name": "applicable-models/paradigm/unsupervised",
    "slug": "applicable-models-paradigm-unsupervised",
    "count": 5,
    "category": "applicable-models"
  },
  {
    "name": "applicable-models/requirements/architecture-specific",
    "slug": "applicable-models-requirements-architecture-specific",
    "count": 4,
    "category": "applicable-models"
  },
  {
    "name": "applicable-models/requirements/black-box",
    "slug": "applicable-models-requirements-black-box",
    "count": 113,
    "category": "applicable-models"
  },
  {
    "name": "applicable-models/requirements/differentiable",
    "slug": "applicable-models-requirements-differentiable",
    "count": 9,
    "category": "applicable-models"
  },
  {
    "name": "applicable-models/requirements/gradient-access",
    "slug": "applicable-models-requirements-gradient-access",
    "count": 18,
    "category": "applicable-models"
  },
  {
    "name": "applicable-models/requirements/gray-box",
    "slug": "applicable-models-requirements-gray-box",
    "count": 1,
    "category": "applicable-models"
  },
  {
    "name": "applicable-models/requirements/model-internals",
    "slug": "applicable-models-requirements-model-internals",
    "count": 17,
    "category": "applicable-models"
  },
  {
    "name": "applicable-models/requirements/probabilistic-output",
    "slug": "applicable-models-requirements-probabilistic-output",
    "count": 10,
    "category": "applicable-models"
  },
  {
    "name": "applicable-models/requirements/white-box",
    "slug": "applicable-models-requirements-white-box",
    "count": 40,
    "category": "applicable-models"
  },
  {
    "name": "assurance-goal-category/explainability",
    "slug": "assurance-goal-category-explainability",
    "count": 46,
    "category": "assurance-goal-category"
  },
  {
    "name": "assurance-goal-category/explainability/attribution-methods/gradient-based",
    "slug": "assurance-goal-category-explainability-attribution-methods-gradient-based",
    "count": 6,
    "category": "assurance-goal-category"
  },
  {
    "name": "assurance-goal-category/explainability/attribution-methods/model-specific",
    "slug": "assurance-goal-category-explainability-attribution-methods-model-specific",
    "count": 4,
    "category": "assurance-goal-category"
  },
  {
    "name": "assurance-goal-category/explainability/attribution-methods/perturbation-based",
    "slug": "assurance-goal-category-explainability-attribution-methods-perturbation-based",
    "count": 10,
    "category": "assurance-goal-category"
  },
  {
    "name": "assurance-goal-category/explainability/causal-analysis/interaction-effects",
    "slug": "assurance-goal-category-explainability-causal-analysis-interaction-effects",
    "count": 1,
    "category": "assurance-goal-category"
  },
  {
    "name": "assurance-goal-category/explainability/causal-analysis/mediation-analysis",
    "slug": "assurance-goal-category-explainability-causal-analysis-mediation-analysis",
    "count": 1,
    "category": "assurance-goal-category"
  },
  {
    "name": "assurance-goal-category/explainability/explains/causal-pathways",
    "slug": "assurance-goal-category-explainability-explains-causal-pathways",
    "count": 4,
    "category": "assurance-goal-category"
  },
  {
    "name": "assurance-goal-category/explainability/explains/data-patterns",
    "slug": "assurance-goal-category-explainability-explains-data-patterns",
    "count": 11,
    "category": "assurance-goal-category"
  },
  {
    "name": "assurance-goal-category/explainability/explains/decision-boundaries",
    "slug": "assurance-goal-category-explainability-explains-decision-boundaries",
    "count": 7,
    "category": "assurance-goal-category"
  },
  {
    "name": "assurance-goal-category/explainability/explains/feature-importance",
    "slug": "assurance-goal-category-explainability-explains-feature-importance",
    "count": 23,
    "category": "assurance-goal-category"
  },
  {
    "name": "assurance-goal-category/explainability/explains/internal-mechanisms",
    "slug": "assurance-goal-category-explainability-explains-internal-mechanisms",
    "count": 12,
    "category": "assurance-goal-category"
  },
  {
    "name": "assurance-goal-category/explainability/explanation-evaluation",
    "slug": "assurance-goal-category-explainability-explanation-evaluation",
    "count": 5,
    "category": "assurance-goal-category"
  },
  {
    "name": "assurance-goal-category/explainability/human-evaluation/decision-study",
    "slug": "assurance-goal-category-explainability-human-evaluation-decision-study",
    "count": 1,
    "category": "assurance-goal-category"
  },
  {
    "name": "assurance-goal-category/explainability/human-evaluation/rating-scale",
    "slug": "assurance-goal-category-explainability-human-evaluation-rating-scale",
    "count": 1,
    "category": "assurance-goal-category"
  },
  {
    "name": "assurance-goal-category/explainability/human-evaluation/understanding-test",
    "slug": "assurance-goal-category-explainability-human-evaluation-understanding-test",
    "count": 2,
    "category": "assurance-goal-category"
  },
  {